<transportStatModel
    xmlns="http://www.ibm.com/xmlns/prod/streams/spl/transportStat"
    xmlns:xsi="http://www.w3.org/2001/XMLSchema-instance"
    xmlns:cmn="http://www.ibm.com/xmlns/prod/streams/spl/common"
    xsi:schemaLocation="http://www.ibm.com/xmlns/prod/streams/spl/transport transportStatModel.xsd">

  <productVersion>1.0.0.0</productVersion>
  <cpuKind>Nahalem</cpuKind>
  <bogoMips>6000</bogoMips>

  <transportProfile>
    <transportKind>tcp</transportKind>
    <tuplePerf>
      <size>4</size>
      <rate>3253475</rate>
      <senderUtil>100</senderUtil>
      <receiverUtil>50</receiverUtil>
    </tuplePerf>
    <tuplePerf>
      <size>8</size>
      <rate>6247488</rate>
      <senderUtil>100</senderUtil>
      <receiverUtil>50</receiverUtil>
    </tuplePerf>
    <tuplePerf>
      <size>16</size>
      <rate>12447510</rate>
      <senderUtil>100</senderUtil>
      <receiverUtil>50</receiverUtil>
    </tuplePerf>
    <tuplePerf>
      <size>32</size>
      <rate>24883569</rate>
      <senderUtil>100</senderUtil>
      <receiverUtil>50</receiverUtil>
    </tuplePerf>
    <tuplePerf>
      <size>64</size>
      <rate>45607313</rate>
      <senderUtil>100</senderUtil>
      <receiverUtil>50</receiverUtil>
    </tuplePerf>
    <tuplePerf>
      <size>128</size>
      <rate>8381895</rate>
      <senderUtil>100</senderUtil>
      <receiverUtil>50</receiverUtil>
    </tuplePerf>
    <tuplePerf>
      <size>256</size>
      <rate>111837171</rate>
      <senderUtil>100</senderUtil>
      <receiverUtil>50</receiverUtil>
    </tuplePerf>
    <tuplePerf>
      <size>512</size>
      <rate>114797277</rate>
      <senderUtil>100</senderUtil>
      <receiverUtil>50</receiverUtil>
    </tuplePerf>
    <tuplePerf>
      <size>1024</size>
      <rate>116182845</rate>
      <senderUtil>100</senderUtil>
      <receiverUtil>50</receiverUtil>
    </tuplePerf>
    <tuplePerf>
      <size>2048</size>
      <rate>116874460</rate>
      <senderUtil>100</senderUtil>
      <receiverUtil>50</receiverUtil>
    </tuplePerf>
    <tuplePerf>
      <size>4096</size>
      <rate>117077435</rate>
      <senderUtil>100</senderUtil>
      <receiverUtil>50</receiverUtil>
    </tuplePerf>
    <tuplePerf>
      <size>8192</size>
      <rate>117412384</rate>
      <senderUtil>100</senderUtil>
      <receiverUtil>50</receiverUtil>
    </tuplePerf>
    <tuplePerf>
      <size>16384</size>
      <rate>117381044</rate>
      <senderUtil>100</senderUtil>
      <receiverUtil>50</receiverUtil>
    </tuplePerf>
  </transportProfile>
</transportStatModel>
